Question,Answer
"1. What is the difference between data, information, and knowledge according to the text?","Data are raw numbers or assertions that may lack context, meaning, or intent. Information is a subset of data that possesses context, relevance, and purpose, involving the manipulation of raw data to obtain a more meaningful indication of trends or patterns. Knowledge, on the other hand, is distinguished from data and information as justified beliefs about relationships among concepts relevant to a particular area. Knowledge is deeper and richer than information and data, involving truths, beliefs, perspectives, judgments, methodologies, and know-how. It is used to determine what a specific situation means and how to handle it."
"2. Provide examples of data, information, and knowledge from the text.","Examples of data, information, and knowledge from the text are:

1. **Data**: 
   - Example 1: The observation that upon tossing a coin it landed heads.
   - Example 2: The wind component (u and v) coordinates for a particular hurricane’s trajectory at specific instances of time.
   - Example 3: That a sales order at a restaurant included two large burgers and two medium-sized vanilla milkshakes.

2. **Information**:
   - Example 1: The numbers indicating the daily sales of burgers, vanilla milkshakes, and other products for the restaurant manager to make decisions regarding pricing and raw material purchases.
   - Example 2: Information about the last 100 coin tosses resulting in 40 heads and 60 tails, used to compute probabilities and expected values for a betting situation.
   - Example 3: Hurricane software models using u and v components to create a forecast of the hurricane trajectory.

3. **Knowledge**:
   - Example 1: The relationship between the quantity of bread to be ordered, the quantity in inventory, and the daily sales of burgers, enabling the computation of the amount of bread to buy.
   - Example 2: The relationship between the probability of heads, the number of times the coin lands heads, and the total number of tosses, helping compute probabilities and expected values for betting decisions.
   - Example 3: The knowledge of a hurricane researcher analyzing wind components and forecasts to determine the probability of a hurricane following a specific trajectory."
"3. How is knowledge defined in the text, and how does it differ from information?","In the text, knowledge is defined as justified beliefs about relationships among concepts relevant to a particular area. This definition suggests that knowledge is deeper and richer than information, as it involves understanding relationships and concepts. Knowledge is distinguished from information by the fact that information is a subset of data that possesses context, relevance, and purpose, while knowledge goes beyond information by involving beliefs and relationships among concepts."
"4. Explain the relationship between data, information, and knowledge as illustrated in Figure 2.1.","In Figure 2.1, the relationship between data, information, and knowledge is depicted as a progression from data to knowledge. Data, which are raw numbers or assertions devoid of context, meaning, or intent, are shown to have zero or low value in making decisions. Information, which is a subset of data that possesses context, relevance, and purpose, is depicted as having greater value than data. Information typically involves manipulating raw data to obtain a more meaningful indication of trends or patterns. Finally, knowledge, which is distinct from data and information, is shown to be at the highest level of value. Knowledge consists of truths, beliefs, perspectives, concepts, judgments, methodologies, and know-how. It is used to receive information, recognize, identify, analyze, interpret, evaluate, synthesize, decide, plan, implement, monitor, and adapt intelligently. 

In summary, Figure 2.1 illustrates that knowledge helps produce information from data or more valuable information from less valuable information. It shows the progression from raw data to meaningful information and ultimately to knowledge, which enables intelligent action and decision-making."
5. How does knowledge help produce information from data or more valuable information from less valuable information?,"Knowledge helps produce information from data or more valuable information from less valuable information by providing the understanding, context, and relationships among the data points. 

For example, in the context of a restaurant manager using daily sales data to make decisions on pricing and raw material purchases, knowledge of how to analyze and interpret this data is essential. This knowledge allows the manager to extract meaningful trends or patterns from the raw sales numbers, turning them into valuable information that can guide decision-making.

Similarly, in a betting scenario where probabilities and expected values need to be calculated based on coin toss outcomes, knowledge of probability theory and decision-making processes is crucial. This knowledge helps in transforming basic data on coin toss results into more valuable information that can be used to make informed decisions on whether to participate in the bet.

In essence, knowledge acts as the bridge between raw data and actionable information, enabling individuals to derive insights, make informed decisions, and take appropriate actions based on the data at hand."
"6. According to Nonaka and Takeuchi, what is their definition of knowledge?","Nonaka and Takeuchi define knowledge as ""a justified true belief."""
"7. How does knowledge, data, and information relate to information systems, decisions, and events as depicted in Figure 2.3?","In Figure 2.3, knowledge, data, and information are depicted in relation to information systems, decisions, and events. Knowledge helps convert data into information. This knowledge can be stored in manual or computer-based information systems, which receive data as input and produce information as output. Making decisions based on this information also requires knowledge. The decisions and other factors lead to events, which in turn generate further data. These events, the use of information, and the information system can cause modifications in knowledge itself. This cycle illustrates how knowledge, data, and information are interconnected within information systems, decisions, and events."
8. Give an example from the text where knowledge is used to make a decision based on information.,"In Example 2 from the text, knowledge is used to make a decision based on information. The example involves Susan considering whether to take up a bet where she would receive $10 if the coin lands heads but lose $8 if it lands tails. By using the information that the coin landed heads 40 times and tails 60 times out of the last 100 tosses, Susan can compute the probabilities of heads and tails. With the knowledge of how to compute probabilities and expected values, Susan can then calculate the expected value of participating in the bet, which is -$0.80. This knowledge enables Susan to make an informed decision on whether to participate in the bet."
"9. How can events, the use of information, and information systems cause modifications in knowledge according to the text?","Events, the use of information, and information systems can cause modifications in knowledge by influencing the relationships between data, information, and knowledge. When events occur, they generate data that can be processed into information. This information, when used in decision-making processes, can lead to modifications in knowledge. For example, in the context of ordering raw materials based on sales, changes in suppliers due to events like mergers can alter the perceived relationship between quantities on hand, daily sales, and the quantity to be ordered. Similarly, the use of information systems to store and process data can lead to new insights and modifications in knowledge. Additionally, the decisions made based on information can also impact knowledge, as they may lead to new experiences or perspectives that shape beliefs and understanding."
10. Discuss the importance of knowledge in determining the meaning of a specific situation and how to handle it based on Wiig's view.,"Wiig's view emphasizes the importance of knowledge in determining the meaning of a specific situation and how to handle it effectively. According to Wiig, knowledge is fundamentally different from data and information. Knowledge consists of truths, beliefs, perspectives, concepts, methodologies, and know-how. It is possessed by individuals and is used to interpret, evaluate, synthesize, and make decisions intelligently.

In Wiig's perspective, knowledge plays a crucial role in understanding what a specific situation means and how to address it. Knowledge helps individuals recognize, identify, analyze, interpret, and evaluate information related to a situation. It enables individuals to act more intelligently by providing them with the necessary insights and understanding to make informed decisions.

Therefore, based on Wiig's view, knowledge is essential for individuals to navigate through complex situations, make sound judgments, and take appropriate actions. It serves as a valuable resource that guides individuals in interpreting information, determining the significance of a situation, and devising effective strategies to handle it efficiently."
